nombre_curso,nivel_del_curso,horas_dedicadas,duracion_del_curso(Semanas),lenguaje,precio(USD),organizacion,cant_estudiantes
How to Learn Online,Principiante,2–3 hours per week,2,Ingles,49.0,edX,124980
Programming for Everybody (Getting Started with Python),Principiante,2–4 hours per week,7,Ingles,49.0,The University of Michigan,293864
CS50's Introduction to Computer Science,Principiante,6–18 hours per week,12,Ingles,90.0,Harvard University,2442271
The Analytics Edge,Intermedio,10–15 hours per week,13,Ingles,199.0,Massachusetts Institute of Technology,129555
Marketing Analytics: Marketing Measurement Strategy,Principiante,5–7 hours per week,4,Ingles,249.0,"University of California, Berkeley",81140
Introduction to Project Management,Principiante,2–3 hours per week,6,Ingles,199.0,University of Adelaide,301793
Leading High-Performing Teams,Intermedio,8–10 hours per week,10,Ingles,5.0,The University of Queensland,32847
The Foundations of Happiness at Work,Principiante,2–3 hours per week,4,Ingles,199.0,"University of California, Berkeley",67073
"Managing Study, Stress and Mental Health at University",Principiante,1–3 hours per week,2,Ingles,49.0,Curtin University,23061
Six Sigma: Define and Measure,Principiante,3–4 hours per week,8,Ingles,99.0,Technische Universität München,92411
Fat Chance: Probability from the Ground Up,Principiante,3–5 hours per week,7,Ingles,49.0,Harvard University,66835
Chasing your Dream: How to End Procrastination and Get a Job You Love,Principiante,2–6 hours per week,5,Ingles,49.0,National Research Nuclear University,44711
Bitcoin and Cryptocurrencies,Principiante,3–5 hours per week,6,Ingles,99.0,"University of California, Berkeley",83398
English Grammar and Style,Principiante,3–4 hours per week,8,Ingles,99.0,The University of Queensland,53260
Ethics in Action,Intermedio,2–4 hours per week,10,Ingles,49.0,SDG Academy,6366
Introduction to FinTech,Principiante,1–3 hours per week,6,Ingles,199.0,University of Hong Kong,72767
Data Science: R Basics,Principiante,1–2 hours per week,8,Ingles,49.0,Harvard University,528782
Python Basics for Data Science,Principiante,2–5 hours per week,5,Ingles,39.0,IBM,228809
The Science of Beer,Principiante,2–4 hours per week,6,Ingles,49.0,Wageningen University & Research,39085
Strategic Social Media Marketing,Avanzado,4–6 hours per week,6,Ingles,399.0,Boston University,103640
CS50's Introduction to Artificial Intelligence with Python,Principiante,10–30 hours per week,7,Ingles,199.0,Harvard University,258006
CS50's Introduction to Game Development,Intermedio,6–9 hours per week,12,Ingles,149.0,Harvard University,346748
Rhetoric: The Art of Persuasive Writing and Public Speaking,Principiante,2–3 hours per week,8,Ingles,99.0,Harvard University,320225
CS50's Web Programming with Python and JavaScript,Intermedio,6–9 hours per week,12,Ingles,90.0,Harvard University,698950
Contract Law: From Trust to Promise to Contract,Intermedio,3–6 hours per week,8,Ingles,125.0,Harvard University,414181
"Fundamentals of Neuroscience, Part 1: The Electrical Properties of the Neuron",Principiante,3–5 hours per week,5,Ingles,99.0,Harvard University,380167
Justice,Principiante,3–6 hours per week,12,Ingles,99.0,Harvard University,392588
Data Science: Machine Learning,Principiante,2–4 hours per week,8,Ingles,49.0,Harvard University,276209
Child Protection: Children's Rights in Theory and Practice,Principiante,2–6 hours per week,16,Ingles,99.0,Harvard University,212453
IELTS Academic Test Preparation,Principiante,5–10 hours per week,8,Ingles,99.0,The University of Queensland,1103777
The Architectural Imagination,Principiante,3–5 hours per week,10,Ingles,99.0,Harvard University,406181
TOEFL® Test Preparation: The Insider’s Guide,Principiante,2–4 hours per week,6,Ingles,49.0,Educational Testing Service,1022489
Principles of Biochemistry,Intermedio,4–6 hours per week,15,Ingles,199.0,Harvard University,257600
Using Python for Research,Intermedio,2–4 hours per week,12,Ingles,99.0,Harvard University,262183
Hinduism Through Its Scriptures,Principiante,5–10 hours per week,4,Ingles,99.0,Harvard University,140782
Basic Spanish 1: Getting Started,Principiante,4–5 hours per week,7,Ingles,40.0,Universitat Politècnica de Valencia,400169
The Health Effects of Climate Change,Principiante,3–5 hours per week,7,Ingles,99.0,Harvard University,110024
Inglés básico: conversacional y networking,Principiante,5–8 hours per week,4,Español,49.0,Universidades Anáhuac,79671
Statistics and R,Intermedio,2–4 hours per week,4,Ingles,249.0,Harvard University,314586
Science & Cooking: From Haute Cuisine to Soft Matter Science (chemistry),Principiante,2–3 hours per week,16,Ingles,199.0,Harvard University,145011
Pyramids of Giza: Ancient Egyptian Art and Archaeology,Principiante,2–4 hours per week,8,Ingles,99.0,Harvard University,123870
"PredictionX: Omens, Oracles & Prophecies",Principiante,3–5 hours per week,1,Ingles,25.0,Harvard University,91566
Excel: Fundamentos y herramientas,Principiante,3–4 hours per week,8,Español,50.0,Universitat Politècnica de Valencia,284279
Lessons from Ebola: Preventing the Next Pandemic,Principiante,3–5 hours per week,4,Ingles,49.0,Harvard University,91983
Improving Global Health: Focusing on Quality and Safety,Intermedio,2–4 hours per week,10,Ingles,99.0,Harvard University,127353
CS50 for Lawyers,Principiante,3–6 hours per week,10,Ingles,99.0,Harvard University,87336
Data Science: Visualization,Principiante,1–2 hours per week,8,Ingles,49.0,Harvard University,171258
Christianity Through Its Scriptures,Principiante,5–10 hours per week,4,Ingles,99.0,Harvard University,125051
The Science of Happiness,Principiante,4–5 hours per week,11,Ingles,169.0,"University of California, Berkeley",475614
Leaders of Learning,Principiante,2–4 hours per week,10,Ingles,99.0,Harvard University,231131
Exercising Leadership: Foundational Principles,Principiante,2–3 hours per week,4,Ingles,99.0,Harvard University,57814
Data Science: Probability,Principiante,1–2 hours per week,8,Ingles,49.0,Harvard University,135859
Introduction to Data Wise: A Collaborative Process to Improve Learning & Teaching,Intermedio,1–2 hours per week,10,Ingles,70.0,Harvard University,117410
"Prescription Drug Regulation, Cost, and Access: Current Controversies in Context",Principiante,2–5 hours per week,8,Ingles,99.0,Harvard University,80082
Introduction to Family Engagement in Education,Principiante,2–4 hours per week,6,Ingles,70.0,Harvard University,105146
Italian Language and Culture: Beginner (2019-2020),Principiante,2–5 hours per week,12,Italiano,49.0,Wellesley College,182462
Steps in Japanese for Beginners1 Part1,Principiante,3–5 hours per week,5,Ingles,49.0,Waseda University,53630
How to Write an Essay,Principiante,5–6 hours per week,5,Ingles,49.0,"University of California, Berkeley",306787
Energy Within Environmental Constraints,Principiante,3–5 hours per week,10,Ingles,99.0,Harvard University,95324
Introduction to Probability,Intermedio,5–10 hours per week,10,Ingles,99.0,Harvard University,97291
AnatomyX: Musculoskeletal Cases,Intermedio,3–6 hours per week,7,Ingles,99.0,Harvard University,102075
Data Science: Inference and Modeling,Principiante,1–2 hours per week,8,Ingles,49.0,Harvard University,88256
Strengthening Community Health Worker Programs,Principiante,2–4 hours per week,6,Ingles,79.0,Harvard University,58626
Buddhism Through Its Scriptures,Principiante,5–10 hours per week,4,Ingles,99.0,Harvard University,182295
Introduction to Linux,Principiante,5–7 hours per week,14,Ingles,199.0,The Linux Foundation,642088
"Bioethics: The Law, Medicine, and Ethics of Reproductive Technologies and Genetics",Principiante,1–2 hours per week,10,Ingles,99.0,Harvard University,81221
Shakespeare's Life and Work,Principiante,5–7 hours per week,4,Ingles,49.0,Harvard University,48938
Marketing Digital: Content & Community Manager,Principiante,3–4 hours per week,5,Español,49.0,Universidad Galileo,112623
Accounting and Finance,Intermedio,2–4 hours per week,11,Ingles,150.0,Indian Institute of Management Bangalore,88243
Computing in Python I: Fundamentals and Procedural Programming,Principiante,9–10 hours per week,5,Ingles,99.0,The Georgia Institute of Technology,141966
"Nutrition, Exercise and Sports",Intermedio,4–8 hours per week,6,Ingles,49.0,Wageningen University & Research,51679
Becoming an Entrepreneur,Principiante,1–3 hours per week,6,Ingles,69.0,Massachusetts Institute of Technology,104760
"Religion, Conflict and Peace",Principiante,4–8 hours per week,8,Ingles,49.0,Harvard University,74060
"Tangible Things: Discovering History Through Artworks, Artifacts, Scientific Specimens, and the Stuff Around You",Principiante,1–3 hours per week,10,Ingles,49.0,Harvard University,61139
Academic and Business Writing,Principiante,3–5 hours per week,6,Ingles,49.0,"University of California, Berkeley",322701
Data Science: Capstone,Principiante,15–20 hours per week,2,Ingles,99.0,Harvard University,62803
Basics of Computing and Programming,Principiante,6–8 hours per week,9,Ingles,200.0,New York University,37045
"Fundamentals of Neuroscience, Part 2: Neurons and Networks",Principiante,3–5 hours per week,6,Ingles,99.0,Harvard University,84874
Successful Negotiation: Essential Strategies and Skills,Principiante,2–4 hours per week,7,Ingles,49.0,The University of Michigan,31369
Data Science: Linear Regression,Principiante,1–2 hours per week,8,Ingles,49.0,Harvard University,75310
HTML5 and CSS Fundamentals,Principiante,4–6 hours per week,6,Ingles,199.0,The World Wide Web Consortium (W3C),335895
Data Science: Productivity Tools,Principiante,1–2 hours per week,8,Ingles,49.0,Harvard University,66683
Introduction to Corporate Finance,Principiante,3–4 hours per week,4,Ingles,225.0,Columbia University,98093
Computer Science 101,Principiante,4–6 hours per week,6,Ingles,149.0,Stanford University,39540
Data Science: Wrangling,Principiante,1–2 hours per week,8,Ingles,49.0,Harvard University,64584
A Hands-on Introduction to Engineering Simulations,Intermedio,4–6 hours per week,6,Ingles,199.0,Cornell University,187138
AI for Everyone: Master the Basics,Principiante,1–2 hours per week,4,Ingles,49.0,IBM,49340
The Psychology of Criminal Justice,Principiante,1–2 hours per week,8,Ingles,99.0,The University of Queensland,110086
Machine Learning with Python: A Practical Introduction,Principiante,4–6 hours per week,5,Ingles,39.0,IBM,80161
Analyzing Data with Python,Principiante,2–4 hours per week,5,Ingles,39.0,IBM,94079
Excel: gestión de datos,Intermedio,4–6 hours per week,6,Español,75.0,Universitat Politècnica de Valencia,111785
Probability - The Science of Uncertainty and Data,Avanzado,10–14 hours per week,16,Ingles,300.0,Massachusetts Institute of Technology,205615
"Fundamentals of Neuroscience, Part 3: The Brain",Principiante,3–5 hours per week,8,Ingles,99.0,Harvard University,85034
Sikhism Through Its Scriptures,Principiante,5–10 hours per week,4,Ingles,99.0,Harvard University,44125
Upper-Intermediate English: Business and Modern Life,Intermedio,3–5 hours per week,4,Ingles,50.0,Universitat Politècnica de Valencia,77991
Religious Literacy: Traditions and Scriptures,Principiante,5–10 hours per week,4,Ingles,99.0,Harvard University,96972
Programación para todos (empezando con Python),Principiante,2–4 hours per week,7,Español,49.0,The University of Michigan,81004
Analyzing and Visualizing Data with Power BI,Principiante,10–20 hours per week,4,Ingles,99.0,Davidson College,28879
High-Dimensional Data Analysis,Avanzado,2–4 hours per week,4,Ingles,149.0,Harvard University,78443
Introduction To Music Theory,Principiante,3–5 hours per week,6,Ingles,49.0,Berklee College of Music,67029
Human Anatomy,Principiante,2–4 hours per week,8,Ingles,139.0,The Hong Kong Polytechnic University,126850
"CitiesX: The Past, Present and Future of Urban Life",Principiante,5–7 hours per week,11,Ingles,99.0,Harvard University,76874
The Path to Happiness: What Chinese Philosophy Teaches us about the Good Life,Principiante,1–2 hours per week,13,Ingles,99.0,Harvard University,24208
Entrepreneurship 101: Who is your customer?,Principiante,2–4 hours per week,10,Ingles,49.0,Massachusetts Institute of Technology,41838
"U.S. Public Policy: Social, Economic, and Foreign Policies",Principiante,2–4 hours per week,4,Ingles,49.0,Harvard University,44045
Machine Learning with Python: from Linear Models to Deep Learning,Avanzado,10–14 hours per week,15,Ingles,300.0,Massachusetts Institute of Technology,85561
Introduction to Data Science,Principiante,3–6 hours per week,6,Ingles,39.0,IBM,43766
Circuits and Electronics 1: Basic Circuit Analysis,Principiante,5–7 hours per week,5,Ingles,169.0,Massachusetts Institute of Technology,52639
Introduction to Investments,Intermedio,3–5 hours per week,5,Ingles,50.0,Indian Institute of Management Bangalore,91788
Improving Your Business Through a Culture of Health,Principiante,1–3 hours per week,9,Ingles,99.0,Harvard University,54136
Introduction to Linear Models and Matrix Algebra,Intermedio,2–4 hours per week,4,Ingles,149.0,Harvard University,92004
DO Your Venture: Entrepreneurship For Everyone,Principiante,3–4 hours per week,6,Ingles,150.0,Indian Institute of Management Bangalore,61989
El valor de la creatividad y la innovación: La Economía Naranja,Principiante,2–4 hours per week,8,Español,25.0,Inter-American Development Bank,23728
Humanitarian Response to Conflict and Disaster,Principiante,3–4 hours per week,5,Ingles,99.0,Harvard University,119891
"Women Making History: Ten Objects, Many Stories",Principiante,2–3 hours per week,8,Ingles,99.0,Harvard University,38939
Masterpieces of World Literature,Principiante,5–7 hours per week,12,Ingles,149.0,Harvard University,88789
SQL for Data Science,Principiante,2–4 hours per week,4,Ingles,39.0,IBM,39184
El cerebro y las emociones en el lenguaje,Principiante,4–5 hours per week,5,Español,49.0,Universidad del Rosario,41279
Science & Cooking: From Haute Cuisine to Soft Matter Science (physics),Principiante,2–3 hours per week,16,Ingles,169.0,Harvard University,62673
Python: aprender a programar,Principiante,3–4 hours per week,8,Español,49.0,Universitat Politècnica de Valencia,21613
Marketing Analytics: Competitive Analysis and Market Segmentation,Intermedio,5–7 hours per week,4,Ingles,249.0,"University of California, Berkeley",70682
MalariaX: Defeating Malaria from the Genes to the Globe,Intermedio,3–5 hours per week,8,Ingles,49.0,Harvard University,37598
Entrepreneurship in Emerging Economies,Principiante,3–5 hours per week,6,Ingles,125.0,Harvard University,113602
JavaScript Introduction,Principiante,6–8 hours per week,5,Ingles,199.0,The World Wide Web Consortium (W3C),160112
People Management,Principiante,2–4 hours per week,6,Ingles,150.0,Indian Institute of Management Bangalore,113592
Using Email for Networking in English,Principiante,3–5 hours per week,4,Ingles,149.0,University of Washington,57208
Databases: Relational Databases and SQL,Principiante,8–10 hours per week,2,Ingles,50.0,Stanford University,20502
C Programming: Getting Started,Principiante,2–4 hours per week,7,Ingles,49.0,Dartmouth_IMTx-Dartmouth College-IMT,104108
Supply Chain Analytics,Principiante,8–12 hours per week,15,Ingles,199.0,Massachusetts Institute of Technology,145049
Programming for the Web with JavaScript,Intermedio,6–8 hours per week,4,Ingles,149.0,University of Pennsylvania,91406
Introduction to Digital Humanities,Principiante,2–4 hours per week,7,Ingles,99.0,Harvard University,37501
Upper-Intermediate English: Business and Industry,Intermedio,3–5 hours per week,4,Ingles,50.0,Universitat Politècnica de Valencia,103704
EmSAT English Preparation - Level 1,Principiante,2–3 hours per week,6,Ingles,49.0,United Arab Emirates University,29101
Python for Data Science,Avanzado,8–10 hours per week,10,Ingles,350.0,"The University of California, San Diego",266978
Empathy and Emotional Intelligence at Work,Principiante,1–2 hours per week,4,Ingles,199.0,"University of California, Berkeley",45867
Design Thinking and Creativity for Innovation,Intermedio,8–10 hours per week,10,Ingles,5.0,The University of Queensland,47549
China and Communism,Principiante,1–3 hours per week,15,Ingles,139.0,Harvard University,69104
Mandarin Chinese Level 1,Principiante,4–10 hours per week,6,Ingles,149.0,MandarinX,56040
Introduction to Biology - The Secret of Life,Principiante,5–10 hours per week,16,Ingles,150.0,Massachusetts Institute of Technology,147512
Photoshop: una herramienta para presentaciones innovadoras,Principiante,8–10 hours per week,5,Español,19.0,Pontificia Universidad Javeriana,22969
Causal Diagrams: Draw Your Assumptions Before Your Conclusions,Principiante,2–3 hours per week,9,Ingles,99.0,Harvard University,50949
生活英语听说 | Conversational English Skills,Principiante,2–4 hours per week,10,Ingles,49.0,Tsinghua University,301585
Shakespeare’s Othello: The Moor,Principiante,5–7 hours per week,4,Ingles,49.0,Harvard University,31868
Basic Spanish 2: One Step Further,Principiante,4–5 hours per week,4,Ingles,50.0,Universitat Politècnica de Valencia,67687
Financial Market Analysis,Intermedio,8–10 hours per week,7,Ingles,25.0,The International Monetary Fund,37452
CS50's Computer Science for Business Professionals,Principiante,2–6 hours per week,6,Ingles,90.0,Harvard University,73208
Gobierno Digital,Principiante,1–2 hours per week,8,Español,25.0,Inter-American Development Bank,18883
Upper-Intermediate English: Business and Globalization,Intermedio,3–5 hours per week,4,Ingles,50.0,Universitat Politècnica de Valencia,58532
The Opioid Crisis in America,Principiante,1–2 hours per week,10,Ingles,99.0,Harvard University,54805
Gestión de Proyectos de Desarrollo,Principiante,3–4 hours per week,10,Español,49.0,Inter-American Development Bank,306286
Statistical Learning,Principiante,3–5 hours per week,9,Ingles,50.0,Stanford University,27968
Introduction to Social Psychology,Principiante,1–2 hours per week,7,Ingles,99.0,The University of Queensland,79365
Artificial Intelligence (AI),Avanzado,8–10 hours per week,12,Ingles,249.0,Columbia University,265104
American Government: Constitutional Foundations,Principiante,2–4 hours per week,4,Ingles,49.0,Harvard University,35504
Introducción a la inversión bursátil,Principiante,3–4 hours per week,2,Español,50.0,Universitat Politècnica de Valencia,64261
Japanese Books: From Manuscript to Print,Principiante,1–2 hours per week,9,Ingles,100.0,Harvard University,17581
Foundations of Modern Finance  I,Avanzado,10–14 hours per week,12,Ingles,450.0,Massachusetts Institute of Technology,24108
Operations Management,Intermedio,2–4 hours per week,7,Ingles,150.0,Indian Institute of Management Bangalore,126093
Marketing Management,Intermedio,2–4 hours per week,9,Ingles,150.0,Indian Institute of Management Bangalore,80010
Marketing enfocado en la estrategia de servicios,Principiante,5–7 hours per week,6,Español,119.0,Universidad Nacional de Córdoba,24618
Introduction to Marketing,Principiante,3–5 hours per week,6,Ingles,150.0,University of British Columbia,169126
Programming Basics,Principiante,6–8 hours per week,9,Ingles,149.0,IITBombay,215059
Probability and Statistics in Data Science using Python,Avanzado,10–12 hours per week,10,Ingles,350.0,"The University of California, San Diego",106286
HTML5 Coding Essentials and Best Practices,Intermedio,6–8 hours per week,6,Ingles,199.0,The World Wide Web Consortium (W3C),241287
First Nights - Beethoven's 9th Symphony and the 19th Century Orchestra,Principiante,3–5 hours per week,3,Ingles,49.0,Harvard University,37426
Cell Biology: Mitochondria,Principiante,2–4 hours per week,4,Ingles,99.0,Harvard University,64142
"Algorithms: Design and Analysis, Part 1",Intermedio,2–4 hours per week,6,Ingles,149.0,Stanford University,20163
Introducción al Office 365,Principiante,2–3 hours per week,7,Español,75.0,Universitat Politècnica de Valencia,16470
Creative Thinking: Techniques and Tools for Success,Principiante,2–4 hours per week,7,Ingles,49.0,Imperial College London,54787
Upper-Intermediate English: Business and Technology,Intermedio,3–5 hours per week,4,Ingles,50.0,Universitat Politècnica de Valencia,47451
Shakespeare's Hamlet: The Ghost,Principiante,5–7 hours per week,4,Ingles,49.0,Harvard University,38331
FlashDiet: Aprende a comer sano,Principiante,2–3 hours per week,5,Español,50.0,Universitat Politècnica de Valencia,48105
CS50's Understanding Technology,Principiante,2–6 hours per week,6,Ingles,90.0,Harvard University,50030
Introduction to Aerospace Structures and Materials,Principiante,4–6 hours per week,8,Ingles,50.0,Delft University of Technology,37126
Visualizing Data with Python,Intermedio,2–4 hours per week,5,Ingles,39.0,IBM,42101
Success: Practical Thinking Skills,Principiante,4–6 hours per week,4,Ingles,50.0,The Hong Kong Polytechnic University,24414
English for Doing Business in Asia – Speaking,Principiante,3–4 hours per week,7,Ingles,60.0,The Hong Kong University of Science and Technology,68422
Nutrition and Health: Macronutrients and Overnutrition,Principiante,6–8 hours per week,9,Ingles,99.0,Wageningen University & Research,208582
"Contemporary China: The People's Republic, Taiwan, and Hong Kong",Principiante,1–3 hours per week,15,Ingles,139.0,Harvard University,66771
Introduction to Clinical Psychology,Principiante,1–2 hours per week,7,Ingles,99.0,The University of Queensland,57234
Modern Masterpieces of World Literature,Principiante,3–6 hours per week,8,Ingles,99.0,Harvard University,48049
"Citizen Politics in America: Public Opinion, Elections, Interest Groups, and the Media",Principiante,2–4 hours per week,4,Ingles,49.0,Harvard University,24259
Applied Scrum for Agile Project Management,Avanzado,2–3 hours per week,4,Ingles,199.0,"The University of Maryland, College Park-University System of Maryland",55293
Corporate Finance,Intermedio,3–5 hours per week,5,Ingles,150.0,Indian Institute of Management Bangalore,62798
Judaism Through Its Scriptures,Principiante,5–10 hours per week,4,Ingles,99.0,Harvard University,50540
Excel avanzado: importación y análisis de datos,Avanzado,3–4 hours per week,8,Español,75.0,Universitat Politècnica de Valencia,47184
CSS Basics,Principiante,5–7 hours per week,5,Ingles,199.0,The World Wide Web Consortium (W3C),95163
Unlocking Information Security: Part I,Intermedio,4–6 hours per week,6,Ingles,149.0,IsraelX-Tel Aviv University,19905
Becoming an Effective Leader,Intermedio,8–10 hours per week,10,Ingles,99.0,The University of Queensland,55937
Digital Branding and Engagement,Intermedio,3–4 hours per week,4,Ingles,99.0,Curtin University,122977
Introduction to Cybersecurity,Principiante,2–5 hours per week,6,Ingles,199.0,University of Washington,73021
General Academic English|生活英语进阶,Principiante,3–4 hours per week,8,Ingles,49.0,Tsinghua University,17526
Gestión de personas: Recursos Humanos,Principiante,5–7 hours per week,5,Español,119.0,Universidad Nacional de Córdoba,19687
From Poverty to Prosperity: Understanding Economic Development,Intermedio,2–3 hours per week,6,Ingles,149.0,University of Oxford,91062
Medical Terminology,Principiante,5–10 hours per week,8,Ingles,79.0,Doane University,31354
Ancient Masterpieces of World Literature,Principiante,3–6 hours per week,6,Ingles,99.0,Harvard University,48899
Shakespeare's The Merchant of Venice: Shylock,Principiante,5–7 hours per week,4,Ingles,49.0,Harvard University,23283
Gestión del estrés y Mindfulness,Principiante,4–5 hours per week,4,Español,49.0,Universidades Anáhuac,15965
Behavioural Economics in Action,Principiante,4–5 hours per week,6,Ingles,139.0,University of Toronto,66764
Finance for Everyone: Smart Tools for Decision-Making,Principiante,5–6 hours per week,6,Ingles,49.0,The University of Michigan,45029
Creating Innovative Business Models,Principiante,2–3 hours per week,4,Ingles,149.0,"University System of Maryland-The University of Maryland, College Park",12227
u.lab: Leading From the Emerging Future,Principiante,4–6 hours per week,14,Ingles,99.0,Massachusetts Institute of Technology,79424
Electric Cars: Introduction,Intermedio,4–5 hours per week,4,Ingles,50.0,Delft University of Technology,56171
Inteligencia Artificial para todos: Domina los fundamentos,Principiante,1–2 hours per week,4,Español,49.0,IBM,11764
Marketing Analytics,Avanzado,8–10 hours per week,12,Ingles,249.0,Columbia University,55228
Introducción a la Regulación Emocional basada en Mindfulness,Principiante,5–6 hours per week,4,Español,49.0,Universidad Autónoma de Madrid,20634
Design Thinking Fundamentals,Intermedio,8–12 hours per week,6,Ingles,299.0,Rochester Institute of Technology,56446
Basic Spanish 3: Getting there,Principiante,3–4 hours per week,4,Ingles,50.0,Universitat Politècnica de Valencia,17569
Mi propia huerta orgánica,Principiante,1–2 hours per week,4,Español,29.0,Universidad Nacional de Córdoba,11346
Sustainability in Architecture: An Interdisciplinary Introduction,Intermedio,3–4 hours per week,4,Ingles,50.0,Universitat Politècnica de Valencia,31352
Gestión de riesgos en proyectos de desarrollo,Intermedio,2–3 hours per week,10,Español,25.0,Inter-American Development Bank,47676
Python Data Structures,Principiante,2–4 hours per week,7,Ingles,49.0,The University of Michigan,36369
The Science and Business of Biotechnology,Intermedio,10–12 hours per week,16,Ingles,49.0,Massachusetts Institute of Technology,17039
Finance Essentials,Principiante,2–4 hours per week,6,Ingles,79.0,Imperial College Business School-Imperial College London,63666
Introduction to the Internet of Things (IoT),Principiante,2–3 hours per week,6,Ingles,149.0,Curtin University,89421
