nombre_curso,nivel_del_curso,horas_dedicadas,duracion_del_curso(Semanas),lenguaje,precio(USD),organizacion,cant_estudiantes
"Portfolio Management, Governance, & the PMO",Principiante,2–5 hours per week,6,Ingles,199.0,University of Washington,17299
edX101: Overview of Creating an edX Course,Principiante,1–2 hours per week,1,Ingles,99.0,edX,22327
"Soy docente, ¡qué miedo! Gestiona eficazmente tus emociones",Principiante,3–4 hours per week,4,Español,49.0,Universidad Autónoma de Madrid,53260
Data Analysis for Decision Making,Avanzado,8–10 hours per week,7,Ingles,214.0,"The University of Maryland, College Park-University System of Maryland",8342
UML Class Diagrams for Software Engineering,Principiante,4–5 hours per week,3,Ingles,49.0,KU Leuven University,33710
Driving Digital Innovation through Experimentation,Avanzado,3–5 hours per week,6,Ingles,399.0,Boston University,16904
Compilation Basics for Macroeconomic Statistics,Principiante,3–6 hours per week,4,Ingles,25.0,The International Monetary Fund,6570
Seguridad Vial en América Latina y el Caribe: de la teoría a la acción,Principiante,2–3 hours per week,10,Español,25.0,Inter-American Development Bank,20189
From Fossil Resources to Biomass: A Chemistry Perspective,Avanzado,20–28 hours per week,5,Ingles,149.0,Wageningen University & Research,5464
System Dynamics for Health Sciences,Intermedio,2–4 hours per week,9,Ingles,139.0,Wits University,15157
Internet de las cosas (IoT) y Big Data,Intermedio,4–6 hours per week,4,Español,49.0,Universidad del Rosario,53260
Introducción a Ciencias de Datos y Estadística Básica para Negocios,Avanzado,5–8 hours per week,4,Español,49.99,Tecnológico de Monterrey,53260
Introduction to Psychological Research Methods,Principiante,1–2 hours per week,7,Ingles,99.0,The University of Queensland,17087
Sustainable Packaging in a Circular Economy,Intermedio,3–4 hours per week,6,Ingles,50.0,Delft University of Technology,6277
Design in Healthcare: Using Patient Journey Mapping,Principiante,3–4 hours per week,8,Ingles,129.0,Delft University of Technology,17946
"El manejo de plagas, malezas y enfermedades en los Sistemas de Siembra Directa",Intermedio,5–7 hours per week,4,Español,99.0,Universidad Nacional de Córdoba,53260
"Electronic, Optical, and Magnetic Properties of Materials",Avanzado,11–13 hours per week,15,Ingles,150.0,Massachusetts Institute of Technology,9717
La España del Quijote,Principiante,5–7 hours per week,7,Español,19.0,Universidad Autónoma de Madrid,13277
Risk Management for Projects,Principiante,2–3 hours per week,5,Ingles,199.0,University of Adelaide,22269
Smithsonian’s Objects That Define America,Principiante,1–2 hours per week,5,Ingles,50.0,The Smithsonian Institution,9071
Creating Modern China: The Republican Period to the Present,Principiante,1–3 hours per week,15,Ingles,139.0,Harvard University,43045
Discover Political Science,Intermedio,4–6 hours per week,10,Ingles,50.0,Université catholique de Louvain,6573
Data Science: Inferential Thinking through Simulations,Principiante,4–6 hours per week,5,Ingles,199.0,"University of California, Berkeley",17505
Programming for Data Science,Principiante,8–10 hours per week,10,Ingles,199.0,University of Adelaide,41268
Public Sector Debt Statistics,Intermedio,6–8 hours per week,6,Ingles,25.0,The International Monetary Fund,53260
Sensor Fusion and Non-linear Filtering for Automotive Systems,Avanzado,10–20 hours per week,6,Ingles,299.0,Chalmers University of Technology,9709
Creación musical con Soundcool: Introducción,Principiante,4–5 hours per week,5,Español,30.0,Universitat Politècnica de Valencia,53260
First Nights - Berlioz’s Symphonie Fantastique and Program Music in the 19th Century,Principiante,3–5 hours per week,3,Ingles,49.0,Harvard University,8222
The Quantum Internet and Quantum Computers: How Will They Change the World?,Principiante,2–3 hours per week,6,Ingles,50.0,Delft University of Technology,15014
Research Methods: An Engineering Approach,Principiante,2–3 hours per week,8,Ingles,169.0,Wits University,20444
Idealismo filosófico y cosmovisiones: cómo hacer mundos con ideas,Principiante,3–5 hours per week,5,Español,49.0,Universidad Autónoma de Madrid,15349
Rise to Leadership: Become a CEO,Intermedio,4–6 hours per week,4,Ingles,199.0,Babson College,16719
Building a Cybersecurity Toolkit,Principiante,2–5 hours per week,6,Ingles,199.0,University of Washington,23275
Marketing your Android apps,Intermedio,6–8 hours per week,5,Ingles,49.0,Universidad Galileo,53260
Embedded Systems Essentials with Arm: Getting Started,Intermedio,3–6 hours per week,6,Ingles,149.0,Arm Education,53260
Life with Diabetes,Principiante,3–4 hours per week,5,Ingles,139.0,Curtin University,12318
Human Reproduction,Intermedio,2–3 hours per week,6,Ingles,169.0,University of Adelaide,5517
Enabling Technologies for Data Science and Analytics: The Internet of Things,Principiante,7–10 hours per week,5,Ingles,99.0,Columbia University,71290
Astrophysics: Exploring Exoplanets,Intermedio,2–4 hours per week,9,Ingles,50.0,Australian National University,48539
Unconventional Reservoir Geomechanics,Principiante,6–8 hours per week,10,Ingles,129.0,Stanford University,53260
Strategic Account Management,Principiante,4–6 hours per week,6,Ingles,149.0,Queen’s University,53260
PyTorch Basics for Machine Learning,Principiante,4–5 hours per week,5,Ingles,39.0,IBM,53260
Diseño y Desarrollo de Recursos Multimedia para la Enseñanza Virtual,Intermedio,4–5 hours per week,4,Español,49.0,Universidad Galileo,14266
Introduction to Cloud Foundry and Cloud Native Software Architecture,Principiante,3–4 hours per week,14,Ingles,169.0,The Linux Foundation,24444
Gestión de compras eficientes para tu empresa,Principiante,3–5 hours per week,5,Español,25.0,LOGYCA,53260
Know HBV And HCV,Principiante,1–5 hours per week,1,Ingles,50.0,Stanford University,53260
The Supreme Court & American Politics,Principiante,4–7 hours per week,8,Ingles,29.0,University of Baltimore-University System of Maryland,6216
Sales Enablement & Analytics,Principiante,4–6 hours per week,6,Ingles,149.0,Queen’s University,53260
Inversión Extranjera como Motor del Desarrollo para América Latina y el Caribe,Intermedio,3–4 hours per week,10,Español,25.0,Inter-American Development Bank,16423
Liderazgo en la empresa familiar,Intermedio,7–8 hours per week,6,Español,49.0,Tecnológico de Monterrey,10969
Comparative Political Systems,Principiante,4–6 hours per week,6,Ingles,59.0,Università degli Studi di Napoli Federico II,6934
Introducción al Derecho en la vida cotidiana,Principiante,5–6 hours per week,5,Español,49.0,Universidad Autónoma de Madrid,53260
Cloud Computing for Enterprises,Intermedio,8–10 hours per week,8,Ingles,299.0,University System of Maryland-University of Maryland Global Campus,27241
Diversity and Social Justice in Social Work,Avanzado,8–10 hours per week,8,Ingles,199.0,The University of Michigan,11055
Public Library Marketing and Public Relations,Principiante,2–3 hours per week,4,Ingles,49.0,The University of Michigan,7525
"Healthcare Finance, Economics and Risk",Intermedio,5–10 hours per week,5,Ingles,199.0,Doane University,8006
Reacciones Químicas y Cálculos Estequiométricos,Principiante,3–4 hours per week,6,Español,49.0,Universitat Politècnica de Valencia,8907
Seeking Women’s Rights: Colonial Period to the Civil War,Intermedio,2–3 hours per week,10,Ingles,50.0,Columbia University,5157
VideoX: Creating Video for the edX Platform,Principiante,2–4 hours per week,2,Ingles,99.0,edX,12159
Comisión de la Verdad Colombia,Principiante,7–10 hours per week,5,Español,29.0,Pontificia Universidad Javeriana,53260
MathTrackX: Probability,Principiante,3–6 hours per week,4,Ingles,79.0,University of Adelaide,53260
Health Informatics for better and safer healthcare,Principiante,3–4 hours per week,4,Ingles,49.0,IsraelX,53260
Sign Language Science: Factors Contributing to Natural Change,Principiante,3–5 hours per week,4,Ingles,99.0,Georgetown University,53260
Accounting System Structure and Information Management,Principiante,1–2 hours per week,4,Ingles,50.0,NYIF,53260
Sustainable Development: The Post-Capitalist Order,Principiante,2–4 hours per week,8,Ingles,49.0,SDG Academy,7031
"Health Law, Policy, and Advocacy",Intermedio,5–10 hours per week,5,Ingles,199.0,Doane University,6358
Introduction to Haptics,Principiante,1–10 hours per week,5,Ingles,129.0,Stanford University,53260
Gestión de inventario y portafolio,Principiante,3–5 hours per week,5,Español,25.0,LOGYCA,53260
Understanding Nuclear Energy,Intermedio,4–6 hours per week,6,Ingles,50.0,Delft University of Technology,16015
Cómo Convertirse en un Líder Exitoso (Entrenamiento de Liderazgo Inclusivo),Principiante,1–2 hours per week,4,Español,50.0,Catalyst,11431
Decision Making Under Uncertainty: Introduction to Structured Expert Judgment,Principiante,4–6 hours per week,6,Ingles,50.0,Delft University of Technology,53260
AP® Calculus BC,Principiante,2–4 hours per week,11,Ingles,49.0,Davidson Next,8542
Advanced Linear Algebra: Foundations to Frontiers,Avanzado,8–12 hours per week,16,Ingles,49.0,The University of Texas at Austin,53260
Entrepreneurial Opportunities,Principiante,2–3 hours per week,5,Ingles,50.0,University of Adelaide,27182
Agua en América Latina: Abundancia en medio de la escasez mundial,Principiante,3–4 hours per week,10,Español,25.0,Inter-American Development Bank,38581
Understanding Political Concepts,Principiante,4–6 hours per week,6,Ingles,59.0,Università degli Studi di Napoli Federico II,7421
How to Code: Complex Data,Principiante,2–3 hours per week,6,Ingles,125.0,University of British Columbia,34190
Hypersonics – from Shock Waves to Scramjets,Avanzado,4–8 hours per week,4,Ingles,99.0,The University of Queensland,19043
Micro and Nanofabrication (MEMS),Avanzado,3–5 hours per week,7,Ingles,199.0,École polytechnique fédérale de Lausanne,16094
Scientific Methods and Research,Intermedio,3–4 hours per week,5,Ingles,49.0,Ural Federal University,7501
Customer Centric Marketing for Entrepreneurs,Intermedio,4–6 hours per week,4,Ingles,149.0,Babson College,14003
Dog Behavior: Problems and Solutions,Intermedio,4–10 hours per week,3,Ingles,169.0,Arizona State University,16467
The Business of Mining,Principiante,2–3 hours per week,4,Ingles,139.0,Curtin University,20406
"Social Work Practice in Community Organization, Management and Policy/Evaluation",Avanzado,8–10 hours per week,8,Ingles,199.0,The University of Michigan,9522
The Business of Aging in the Longevity Economy,Principiante,1–2 hours per week,4,Ingles,139.0,Georgetown University,53260
Understanding the Australian Health Care System,Principiante,1–2 hours per week,9,Ingles,59.0,The University of Queensland,8343
Age of Sustainable Development,Intermedio,4–6 hours per week,14,Ingles,49.0,SDG Academy,10019
Internationalization: Creating Digital Content for the World,Avanzado,2–5 hours per week,4,Ingles,199.0,University of Washington,53260
Multi-Object Tracking for Automotive Systems,Avanzado,10–20 hours per week,10,Ingles,249.0,Chalmers University of Technology,8581
Economics and Policies in a Biobased Economy,Avanzado,12–20 hours per week,4,Ingles,149.0,Wageningen University & Research,53260
Strategic Leadership in Healthcare,Intermedio,5–10 hours per week,5,Ingles,199.0,Doane University,6237
Terrorism and Counterterrorism: An Introduction,Principiante,8–10 hours per week,3,Ingles,49.0,Georgetown University,14128
Exploring Psychology's Core Concepts|走进心理学,Principiante,3–5 hours per week,6,Ingles,139.0,Tsinghua University,5741
Creating Virtual Reality (VR) Apps,Intermedio,5–7 hours per week,6,Ingles,99.0,"The University of California, San Diego",22349
Análisis Multivariable en SPSS,Principiante,4–5 hours per week,5,Español,49.0,Universidad Galileo,53260
Steps in Japanese for Beginners2 Part1,Principiante,3–5 hours per week,5,Ingles,99.0,Waseda University,53260
"Competencias para buscar, mantener y promocionar en un empleo",Principiante,3–5 hours per week,4,Español,49.0,Universidad Autónoma de Madrid,53260
Dynamics and Control,Principiante,4–5 hours per week,6,Ingles,50.0,Universitat Politècnica de Valencia,27763
Finding Your Cybersecurity Career Path,Principiante,2–5 hours per week,6,Ingles,199.0,University of Washington,19283
Introducción a la caligrafía y paleografía en archivos hispanos medievales y modernos,Principiante,3–4 hours per week,6,Español,29.0,Universidad Carlos III de Madrid,12674
Mechanics: Rotational Dynamics,Intermedio,10–12 hours per week,12,Ingles,49.0,Massachusetts Institute of Technology,13183
Applying Health Coaching in Patient Care,Principiante,5–10 hours per week,3,Ingles,199.0,Doane University,53260
Databases: Modeling and Theory,Principiante,8–10 hours per week,2,Ingles,50.0,Stanford University,53260
"Islamic Banking: Principles, Practice and Risk Management",Principiante,3–6 hours per week,4,Ingles,49.0,The Islamic Research and Training Institute,53260
Liderazgo orientado al florecimiento humano,Principiante,5–8 hours per week,4,Español,149.0,Tecnológico de Monterrey,7911
Software Construction: Object-Oriented Design,Intermedio,8–10 hours per week,6,Ingles,125.0,University of British Columbia,23100
"Introduction to Hyperledger Sovereign Identity Blockchain Solutions: Indy, Aries & Ursa",Principiante,2–3 hours per week,7,Ingles,199.0,The Linux Foundation,53260
Fondements de l’économie sociale et solidaire,Intermedio,2–3 hours per week,12,Frances,50.0,Université catholique de Louvain,53260
The Civil War and Reconstruction - 1861 - 1865: A New Birth of Freedom,Principiante,6–8 hours per week,12,Ingles,50.0,Columbia University,17941
Innovation Strategies for Electric Mobility: The StreetScooter Case,Intermedio,2–4 hours per week,6,Ingles,99.0,RWTH Aachen University,53260
Sustainable Energy,Avanzado,8–12 hours per week,13,Ingles,149.0,Massachusetts Institute of Technology,53260
Designing and Leading Learning Systems,Avanzado,2–4 hours per week,8,Ingles,199.0,The University of Michigan,11895
How the U.S. Government Works & How to Get Involved,Principiante,4–5 hours per week,6,Ingles,49.0,Georgetown University,5930
Inspiring and Motivating Arts and Culture Teams,Principiante,3–5 hours per week,5,Ingles,49.0,The University of Michigan,10817
Principles of Microeconomics: An Economist Way of Thinking,Intermedio,1–2 hours per week,6,Ingles,149.0,The University of Queensland,53260
A System View of Communications: From Signals to Packets (Part 1),Principiante,4–6 hours per week,7,Ingles,60.0,The Hong Kong University of Science and Technology,34261
"Invasions, Rebellions, and the Fall of Imperial China",Principiante,1–3 hours per week,15,Ingles,139.0,Harvard University,41537
AP® English Literature & Composition – Part 3: Plays,Principiante,4–5 hours per week,7,Ingles,49.0,"University of California, Berkeley",6443
Cómo implantar grupos de mejora de procesos,Principiante,3–4 hours per week,8,Español,150.0,Universitat Politècnica de Valencia,28100
Proteins: Biology's Workforce,Intermedio,4–6 hours per week,5,Ingles,169.0,Rice University,25893
Introducción a los ritmos y relojes biológicos,Principiante,6–8 hours per week,4,Español,50.0,Universidad Nacional de Córdoba,6149
Linear Algebra I: Linear Equations,Intermedio,5–6 hours per week,3,Ingles,199.0,The Georgia Institute of Technology,53260
"Fundamentals of Biomedical Imaging: Ultrasounds, X-ray, positron emission tomography (PET) and applications",Avanzado,4–5 hours per week,7,Ingles,169.0,École polytechnique fédérale de Lausanne,10205
Fundamentos de Electromagnetismo para Ingeniería,Principiante,4–5 hours per week,7,Español,49.0,Universitat Politècnica de Valencia,15040
Sustainable Food Systems: A Mediterranean Perspective,Intermedio,2–4 hours per week,10,Ingles,49.0,SDG Academy,6480
Scripting and Programming Foundations,Principiante,9–10 hours per week,8,Ingles,299.7,Western Governors University,53260
Using GPUs to Scale and Speed-up Deep Learning,Intermedio,2–4 hours per week,5,Ingles,99.0,IBM,9294
StudioX: Creating a Course with edX Studio,Principiante,4–6 hours per week,3,Ingles,99.0,edX,20355
The Power of Data,Principiante,1–5 hours per week,2,Ingles,49.0,Rolls-Royce,53260
Introducción a las ondas gravitacionales,Principiante,5–7 hours per week,4,Español,50.0,Universidad Nacional de Córdoba,8657
Drones and Autonomous Systems 2: Applications in Emergency Management,Intermedio,2–3 hours per week,6,Ingles,149.0,University of Maryland Global Campus-University System of Maryland,53260
MathTrackX: Differential Calculus,Principiante,3–6 hours per week,4,Ingles,79.0,University of Adelaide,53260
Global China: From the Mongols to the Ming,Principiante,1–3 hours per week,15,Ingles,139.0,Harvard University,41902
Leaders in Citizen Security and Justice Management for the Caribbean,Intermedio,4–5 hours per week,10,Ingles,25.0,Inter-American Development Bank,53260
Pattern Studying and Making | 图案审美与创作,Principiante,3–5 hours per week,12,Chino,139.0,Tsinghua University,53260
Computational Neuroscience: Neuronal Dynamics of Cognition,Avanzado,4–6 hours per week,6,Ingles,139.0,École polytechnique fédérale de Lausanne,11246
Cities and the Challenge of Sustainable Development,Principiante,1–2 hours per week,1,Ingles,25.0,SDG Academy,8775
MathTrackX: Special Functions,Principiante,3–6 hours per week,4,Ingles,79.0,University of Adelaide,53260
The ArchitecturalImagination…,Principiante,3–5 hours per week,10,Ingles,199.0,Harvard University,415051
The Path to Happiness:What Chinese PhilosophyTeaches us about the G……,Principiante,1–2 hours per week,13,Ingles,99.0,Harvard University,29623
Pyramids of Giza: AncientEgyptian Art andArchaeology…,Principiante,2–4 hours per week,8,Ingles,149.0,Harvard University,127414
"U.S. Public Policy: Social,Economic, and ForeignPolicies…",Principiante,2–4 hours per week,4,Ingles,99.0,Harvard University,46472
"Women Making History:Ten Objects, ManyStories…",Principiante,2–3 hours per week,8,Ingles,139.0,Harvard University,40788
Buddhism Through ItsScriptures…,Principiante,5–10 hours per week,4,Ingles,99.0,Harvard University,184691
Masterpieces of WorldLiterature…,Principiante,5–7 hours per week,12,Ingles,199.0,Harvard University,91907
"Religion, Conflict andPeace…",Principiante,4–8 hours per week,8,Ingles,99.0,Harvard University,76302
Hinduism Through ItsScriptures…,Principiante,5–10 hours per week,4,Ingles,99.0,Harvard University,142438
American Government:ConstitutionalFoundations…,Principiante,2–4 hours per week,4,Ingles,99.0,Harvard University,37691
"CitiesX: The Past,Present and Future ofUrban Life…",Principiante,5–7 hours per week,11,Ingles,169.0,Harvard University,79152
Rhetoric: The Art ofPersuasive Writing andPublic Speaking…,Principiante,2–3 hours per week,8,Ingles,169.0,Harvard University,336791
Christianity Through ItsScriptures…,Principiante,5–10 hours per week,4,Ingles,99.0,Harvard University,127023
"PredictionX: Omens,Oracles & Prophecies…",Principiante,3–5 hours per week,1,Ingles,49.0,Harvard University,94663
Shakespeare's Life andWork…,Principiante,5–7 hours per week,4,Ingles,99.0,Harvard University,51046
Religious Literacy:Traditions and Scriptures…,Principiante,5–10 hours per week,4,Ingles,99.0,Harvard University,98874
"Citizen Politics inAmerica: Public Opinion,Elections, Interest Grou……",Principiante,2–4 hours per week,4,Ingles,99.0,Harvard University,25444
"Hollywood: History,Industry, Art…",Principiante,3–4 hours per week,4,Ingles,169.0,University of Pennsylvania,51321
"Tangible Things:Discovering HistoryThrough Artworks, Artif……",Principiante,1–3 hours per week,10,Ingles,49.0,Harvard University,63594
"U.S. Political Institutions:Congress, Presidency,Courts, and Bureaucracy…",Principiante,2–4 hours per week,4,Ingles,99.0,Harvard University,24395
European Paintings: FromLeonardo to Rembrandtto Goya…,Principiante,2–3 hours per week,7,Ingles,99.0,Universidad Carlos III de Madrid,62403
Islam Through ItsScriptures…,Principiante,5–10 hours per week,4,Ingles,99.0,Harvard University,67278
Shakespeare's Hamlet:The Ghost…,Principiante,5–7 hours per week,4,Ingles,99.0,Harvard University,39259
Judaism Through ItsScriptures…,Principiante,5–10 hours per week,4,Ingles,99.0,Harvard University,51192
Japanese Books: FromManuscript to Print…,Principiante,1–2 hours per week,9,Ingles,100.0,Harvard University,18404
PredictionX: Lost WithoutLongitude…,Principiante,2–5 hours per week,1,Ingles,49.0,Harvard University,10689
Sikhism Through ItsScriptures…,Principiante,5–10 hours per week,4,Ingles,99.0,Harvard University,44620
Gender andIntersectionality…,Principiante,2–5 hours per week,6,Ingles,50.0,The University of Iceland,5188
Shakespeare’s Othello:The Moor…,Principiante,5–7 hours per week,4,Ingles,99.0,Harvard University,32430
18th-Century Opera:Handel & Mozart…,Principiante,3–4 hours per week,5,Ingles,139.0,Harvard University,18985
"Pintura europea:Leonardo, Rembrandt,Goya…",Principiante,2–3 hours per week,7,Español,29.0,Universidad Carlos III de Madrid,33346
Fighting for Equality:1950–2018…,Intermedio,2–3 hours per week,10,Ingles,50.0,Columbia University,9774
China and Communism…,Principiante,1–3 hours per week,15,Ingles,99.0,Harvard University,69811
Shakespeare's TheMerchant of Venice:Shylock…,Principiante,5–7 hours per week,4,Ingles,99.0,Harvard University,23690
The Civil War andReconstruction -1850-1861: A House Div……,Principiante,6–8 hours per week,15,Ingles,50.0,Columbia University,24059
"Contemporary China: ThePeople's Republic,Taiwan, and Hong Kong…",Principiante,1–3 hours per week,15,Ingles,99.0,Harvard University,67356
Arab-Islamic History:From Tribes to Empires…,Principiante,3–4 hours per week,8,Ingles,149.0,"IsraelX, Tel Aviv University",18262
China’s Political andIntellectual Foundations:From Sage Kings to Con……,Principiante,1–3 hours per week,15,Ingles,99.0,Harvard University,47716
The Rise of Superheroesand Their Impact On PopCulture…,Principiante,1–2 hours per week,6,Ingles,50.0,The Smithsonian Institution,31684
The Einstein Revolution…,Principiante,2–3 hours per week,14,Ingles,99.0,Harvard University,25985
The Threat of NuclearTerrorism…,Principiante,1–5 hours per week,5,Ingles,50.0,Stanford University,45365
Terrorism andCounterterrorism…,Principiante,8–10 hours per week,7,Ingles,49.0,Georgetown University,29122
"First Nights - Stravinsky’sRite of Spring:Modernism, Ballet, and……",Principiante,3–5 hours per week,3,Ingles,49.0,Harvard University,17873
American Prophet: TheInner Life and GlobalVision of Martin Luther……,Principiante,2–4 hours per week,11,Ingles,50.0,Stanford University,45365
Globalization: Past andFuture…,Principiante,2–4 hours per week,4,Ingles,25.0,SDG Academy,10663
Indian & Tibetan River ofBuddhism…,Intermedio,2–4 hours per week,12,Ingles,49.99,Columbia University,7079
Modern JapaneseArchitecture Part 1: FromMeiji Restoration to the……,Intermedio,3–5 hours per week,5,Ingles,59.0,Tokyo Institute of Technology,45365
"19th-Century Opera:Meyerbeer, Wagner, &Verdi…",Principiante,3–5 hours per week,6,Ingles,139.0,Harvard University,9650
The Medieval IcelandicSagas…,Intermedio,2–3 hours per week,6,Ingles,50.0,The University of Iceland,11554
China’s First Empires andthe Rise of Buddhism…,Principiante,1–3 hours per week,15,Ingles,99.0,Harvard University,46514
The Conquest of Space:Space Exploration andRocket Science…,Principiante,3–4 hours per week,7,Ingles,129.0,Universidad Carlos III de Madrid,20308
Modern China’sFoundations: TheManchus and the Qing…,Principiante,1–3 hours per week,15,Ingles,99.0,Harvard University,47575
The Civil War andReconstruction - 1861 -1865: A New Birth of Fr……,Principiante,6–8 hours per week,12,Ingles,50.0,Columbia University,18159
Historia de la ética…,Principiante,1–3 hours per week,6,Español,29.0,Universidad Carlos III de Madrid,9681
La España del Quijote…,Principiante,5–7 hours per week,7,Español,19.0,Universidad Autónoma de Madrid,13531
"Introducción al griegoclásico: verbos, oracionesy filosofía…",Principiante,4–5 hours per week,5,Español,29.0,Universidad Autónoma de Madrid,45365
The Supreme Court &American Politics…,Principiante,4–7 hours per week,8,Ingles,29.0,"University of Baltimore, University System of Maryland",6596
Seeking Women’s Rights:Colonial Period to theCivil War…,Intermedio,2–3 hours per week,10,Ingles,50.0,Columbia University,5342
Creating Modern China:The Republican Period tothe Present…,Principiante,1–3 hours per week,15,Ingles,99.0,Harvard University,43350
Star Trek: InspiringCulture and Technology…,Principiante,1–3 hours per week,7,Ingles,40.0,The Smithsonian Institution,6710
Introducción a lacaligrafía y paleografíaen archivos hispanos m……,Principiante,3–4 hours per week,6,Español,29.0,Universidad Carlos III de Madrid,12904
Chinese History FromWarring States to theTang Dynasty | 资治通鉴…,Principiante,2–3 hours per week,18,Chino,49.0,Tsinghua University,12296
Global China: From theMongols to the Ming…,Principiante,1–3 hours per week,15,Ingles,99.0,Harvard University,42150
Terrorism andCounterterrorism: AnIntroduction…,Principiante,8–10 hours per week,3,Ingles,49.0,Georgetown University,14326
Smithsonian’s ObjectsThat Define America…,Principiante,1–2 hours per week,5,Ingles,50.0,The Smithsonian Institution,9174
Cosmopolitan Tang:Aristocratic Culture inChina…,Principiante,1–3 hours per week,15,Ingles,99.0,Harvard University,41383
